{
  "id": "ppg-raw-type6-sport-id",
  "area": "sensor-parser",
  "case": "ppg_raw_type6_sport_id_trail_running",
  "source": "Android PpgDataTest and iOS PpgDataTest",
  "input": {
    "dataFrameHex": "010094357700000000061b00000000000000",
    "previousTimeStamp": 100,
    "factor": 1.0,
    "sampleRate": 0
  },
  "expected": {
    "measurementType": "PPG",
    "frameType": 6,
    "compressed": false,
    "timeStamp": 2000000000,
    "samples": [
      {
        "timeStamp": 2000000000,
        "sportId": 27
      }
    ]
  },
  "platforms": {
    "android": true,
    "ios": true,
    "common": true
  },
  "consumerTests": {
    "android": [
      "com.polar.androidcommunications.api.ble.model.gatt.client.pmd.model.PpgDataTest"
    ],
    "ios": [
      "PpgDataTest"
    ],
    "commonPrototype": [
      "com.polar.sharedtest.PpgParserCommonPolicyTest"
    ]
  }
}
