{
  "id": "training-session-readiness",
  "area": "sdk.training-session",
  "case": "training_session_readiness",
  "source": "Training-session discovery, payload-read, and parser-ownership vectors plus shared common prototype distilled into a pre-KMP readiness manifest",
  "description": "Pins the training-session behavior families that must remain covered before discovery/read orchestration delegates to shared KMP code.",
  "input": {
    "kind": "trainingSessionReadiness",
    "policyVectorPaths": [
      "sdk/training-session/reference-discovery-two-sessions.json",
      "sdk/training-session/missing-exercise-file-platform-policy.json",
      "sdk/training-session/payload-read-policy.json",
      "sdk/training-session/payload-parser-policy.json"
    ],
    "requiredBehaviorFamilies": [
      "reference-directory-traversal",
      "training-summary-discovery",
      "exercise-file-classification",
      "unknown-file-ignoring",
      "aggregate-file-size-policy",
      "exercise-path-shape-policy",
      "missing-exercise-file-platform-policy",
      "payload-fetch-order",
      "payload-progress-calculation",
      "malformed-component-isolation",
      "unknown-advanced-sample-list-ignoring",
      "known-sample-preservation",
      "payload-parser-family-ownership",
      "byte-level-parser-dependency-gate",
      "protobuf-gzip-byte-decoding-deferral",
      "platform-training-session-vector-reference-gate",
      "compile-verification-gate"
    ]
  },
  "expected": {
    "coveredBehaviorFamilies": [
      "reference-directory-traversal",
      "training-summary-discovery",
      "exercise-file-classification",
      "unknown-file-ignoring",
      "aggregate-file-size-policy",
      "exercise-path-shape-policy",
      "missing-exercise-file-platform-policy",
      "payload-fetch-order",
      "payload-progress-calculation",
      "malformed-component-isolation",
      "unknown-advanced-sample-list-ignoring",
      "known-sample-preservation",
      "payload-parser-family-ownership",
      "byte-level-parser-dependency-gate",
      "protobuf-gzip-byte-decoding-deferral",
      "platform-training-session-vector-reference-gate",
      "compile-verification-gate"
    ],
    "commonDecision": "Training-session migration may proceed only after every vector named by this readiness manifest is executable from shared commonTest, Android and iOS training-session tests continue to reference the same vectors, directory traversal, summary discovery, exercise classification, unknown-file ignoring, aggregate size, exercise path policy, missing exercise-file policy, payload fetch order, progress, malformed component isolation, unknown advanced sample-list handling, known sample preservation, parser-family ownership, byte-level parser dependency gates, protobuf/gzip byte decoding deferral, and compile verification remain explicit before production discovery/read orchestration moves."
  },
  "consumerTests": {
    "android": [
      "com.polar.sdk.api.model.utils.PolarTrainingSessionUtilsTest"
    ],
    "ios": [
      "PolarTrainingSessionUtilsTest"
    ],
    "commonPrototype": [
      "com.polar.sharedtest.TrainingSessionCommonPolicyTest"
    ]
  },
  "platforms": {
    "android": true,
    "ios": true,
    "common": true
  },
  "notes": "This readiness manifest gates training-session discovery/read orchestration behavior-family completeness only; real byte-level protobuf/gzip decoding remains deferred until common production parser dependencies exist and are compile-verified."
}
