{
  "id": "disk-space-readiness",
  "area": "sdk.disk-space",
  "case": "disk_space_readiness",
  "source": "Disk-space vectors and shared common prototype distilled into a shared-ownership readiness manifest",
  "description": "Pins the disk-space model behavior families that must remain covered before disk-space conversion delegates to shared code.",
  "input": {
    "kind": "diskSpaceReadiness",
    "policyVectorPaths": [
      "sdk/disk-space/typical-fragments.json",
      "sdk/disk-space/zero-fragments.json",
      "sdk/disk-space/uint32-max-fragment-platform-difference.json",
      "sdk/disk-space/malformed-truncated-varint.json"
    ],
    "requiredBehaviorFamilies": [
      "byte-total-calculation",
      "free-byte-calculation",
      "zero-fragment-counts",
      "unsigned-uint32-fragment-size-policy",
      "android-signed-fragment-platform-reference",
      "ios-unsigned-fragment-platform-reference",
      "typed-malformed-varint-parse-error",
      "platform-disk-space-vector-reference-gate",
      "compile-verification-gate"
    ]
  },
  "expected": {
    "coveredBehaviorFamilies": [
      "byte-total-calculation",
      "free-byte-calculation",
      "zero-fragment-counts",
      "unsigned-uint32-fragment-size-policy",
      "android-signed-fragment-platform-reference",
      "ios-unsigned-fragment-platform-reference",
      "typed-malformed-varint-parse-error",
      "platform-disk-space-vector-reference-gate",
      "compile-verification-gate"
    ],
    "commonDecision": "Disk-space model shared ownership remains valid while every vector named by this readiness manifest is executable from shared commonTest, Android and iOS disk-space tests continue to reference the same vectors, byte-total and free-byte calculations remain covered, zero-fragment counts remain explicit, fragment size uses the unsigned 32-bit policy instead of inheriting Android signed-int exposure or Swift UInt32 behavior accidentally, malformed truncated varints map to typed parse errors, and the shared tests are compile-verified."
  },
  "consumerTests": {
    "android": [
      "com.polar.sdk.api.model.PolarDiskSpaceTest"
    ],
    "ios": [
      "PolarDiskSpaceDataTest"
    ],
    "commonPrototype": [
      "com.polar.sharedtest.DiskSpaceCommonPolicyTest"
    ]
  },
  "platforms": {
    "android": true,
    "ios": true,
    "common": true
  },
  "notes": "This readiness manifest is a shared ownership gate for disk-space model behavior-family completeness only; public platform adapters may preserve legacy signed or unsigned scalar exposure only after the shared unsigned policy is compile-verified."
}
